{
  "map": {
    "width": 20,
    "height": 15
  },
  "boxes": [
    {
      "box_id": 0,
      "position": [
        6,
        8
      ],
      "goods_ids": [
        0,
        1
      ],
      "size": 1
    },
    {
      "box_id": 1,
      "position": [
        6,
        10
      ],
      "goods_ids": [
        2,
        3
      ],
      "size": 1
    },
    {
      "box_id": 2,
      "position": [
        6,
        12
      ],
      "goods_ids": [
        4,
        5
      ],
      "size": 1
    },
    {
      "box_id": 3,
      "position": [
        6,
        14
      ],
      "goods_ids": [
        6,
        7
      ],
      "size": 1
    },
    {
      "box_id": 4,
      "position": [
        8,
        8
      ],
      "goods_ids": [
        8,
        9
      ],
      "size": 1
    },
    {
      "box_id": 5,
      "position": [
        8,
        10
      ],
      "goods_ids": [
        10,
        11
      ],
      "size": 1
    },
    {
      "box_id": 6,
      "position": [
        8,
        12
      ],
      "goods_ids": [
        12,
        13
      ],
      "size": 1
    },
    {
      "box_id": 7,
      "position": [
        8,
        14
      ],
      "goods_ids": [
        14,
        15
      ],
      "size": 1
    }
  ],
  "receivers": [
    {
      "receiver_id": 0,
      "position": [
        13,
        5
      ],
      "size": 1
    },
    {
      "receiver_id": 1,
      "position": [
        13,
        14
      ],
      "size": 1
    }
  ],
  "wait_zones": [
    {
      "wait_zone_id": 0,
      "position": [
        1,
        2
      ],
      "size": 2
    },
    {
      "wait_zone_id": 1,
      "position": [
        1,
        5
      ],
      "size": 2
    },
    {
      "wait_zone_id": 2,
      "position": [
        1,
        8
      ],
      "size": 1
    },
    {
      "wait_zone_id": 3,
      "position": [
        1,
        10
      ],
      "size": 1
    }
  ],
  "agvs": [
    {
      "agv_id": 0,
      "size": 2
    },
    {
      "agv_id": 1,
      "size": 2
    },
    {
      "agv_id": 2,
      "size": 1
    },
    {
      "agv_id": 3,
      "size": 1
    }
  ],
  "obstacles": [
    [
      10,
      3
    ],
    [
      4,
      16
    ]
  ]
}